{
	"$schema": "https://json-schema.org/draft/2020-12/schema",
	"$id": "https://de-linker.com/schemas/engine/feed.schema.json",
	"title": "Engineering feed",
	"description": "What the engine reads from linker-commerce: GET /wp-json/linker/v1/engineering-feed (docs/specs/8-engineering-data.md, target shape 5). One entry per published product. The top-level facts are the #7 SelectionFactSet (docs/specs/7-selection-facts.md), produced by its single implementation in linker-commerce, so the engine never re-derives them; `figures` are the cited datasheet values the engine needs beyond those facts, units as stored (the engine converts by `unit`). A figure without a citation to a document we host does not enter the feed.",
	"type": "object",
	"required": ["schema_version", "generated_at", "compatibility_version", "products", "overlay"],
	"additionalProperties": false,
	"properties": {
		"schema_version": { "const": 1 },
		"generated_at": { "type": "string", "format": "date-time" },
		"compatibility_version": {
			"description": "The `version` of the data/compatibility.json the feed was generated with.",
			"type": "string",
			"minLength": 1
		},
		"products": { "type": "array", "items": { "$ref": "#/$defs/product" } },
		"overlay": {
			"description": "data/engineering-overlay.json: engineering items that are not products (the reference PV module).",
			"type": "array",
			"items": { "$ref": "#/$defs/overlayItem" }
		}
	},
	"$defs": {
		"unknown": { "const": "unknown" },
		"number": { "type": "number", "minimum": 0 },
		"product": {
			"type": "object",
			"required": [
				"id",
				"sku",
				"model",
				"brand",
				"series",
				"device_class",
				"application",
				"phase",
				"ac_power_kw",
				"pv_input_kw",
				"usable_kwh",
				"nominal_kwh",
				"kwh_range",
				"figures",
				"documents"
			],
			"additionalProperties": false,
			"properties": {
				"id": { "type": "integer", "minimum": 1 },
				"sku": { "type": "string" },
				"model": {
					"description": "pa_model; compatibility patterns are matched against it.",
					"type": "string",
					"minLength": 1
				},
				"brand": { "type": "string" },
				"series": {
					"description": "pa_series (#8 target shape 2); null until assigned.",
					"type": ["string", "null"]
				},
				"device_class": {
					"description": "Slug of the product's primary product category.",
					"type": "string",
					"pattern": "^[a-z0-9-]+$"
				},
				"application": { "enum": ["home", "commercial", "unknown"] },
				"phase": { "oneOf": [{ "enum": [1, 3] }, { "$ref": "#/$defs/unknown" }] },
				"ac_power_kw": { "oneOf": [{ "$ref": "#/$defs/number" }, { "$ref": "#/$defs/unknown" }] },
				"pv_input_kw": { "oneOf": [{ "$ref": "#/$defs/number" }, { "$ref": "#/$defs/unknown" }] },
				"usable_kwh": { "oneOf": [{ "$ref": "#/$defs/number" }, { "$ref": "#/$defs/unknown" }] },
				"nominal_kwh": { "oneOf": [{ "$ref": "#/$defs/number" }, { "$ref": "#/$defs/unknown" }] },
				"kwh_range": {
					"description": "A stated energy range (for example 57.3-100.3 kWh) that #7 keeps out of the scalars.",
					"oneOf": [
						{ "type": "null" },
						{
							"type": "object",
							"required": ["min", "max"],
							"additionalProperties": false,
							"properties": { "min": { "$ref": "#/$defs/number" }, "max": { "$ref": "#/$defs/number" } }
						}
					]
				},
				"figures": { "$ref": "#/$defs/figures" },
				"documents": { "type": "array", "items": { "$ref": "#/$defs/document" } }
			}
		},
		"overlayItem": {
			"type": "object",
			"required": ["id", "kind", "brand", "model", "figures", "documents"],
			"additionalProperties": false,
			"properties": {
				"id": { "type": "string", "minLength": 1 },
				"kind": { "enum": ["pv_module"] },
				"brand": { "type": "string" },
				"model": { "type": "string" },
				"figures": { "$ref": "#/$defs/figures" },
				"documents": { "type": "array", "items": { "$ref": "#/$defs/document" } }
			}
		},
		"figures": {
			"description": "Figure key -> cited value. Keys the engine reads are listed in docs/specs/8-engineering-data.md target shape 1.",
			"type": "object",
			"propertyNames": { "pattern": "^[a-z0-9_]+$" },
			"additionalProperties": { "$ref": "#/$defs/figure" }
		},
		"figure": {
			"type": "object",
			"required": ["value", "unit", "citation"],
			"additionalProperties": false,
			"properties": {
				"value": { "type": ["string", "number"] },
				"value_de": { "type": "string" },
				"unit": { "type": ["string", "null"] },
				"citation": { "$ref": "#/$defs/citation" }
			}
		},
		"citation": {
			"type": "object",
			"required": ["url"],
			"additionalProperties": false,
			"properties": {
				"url": { "$ref": "#/$defs/hostedUrl" },
				"page": { "type": "integer", "minimum": 1 }
			}
		},
		"document": {
			"type": "object",
			"required": ["url", "title", "type", "lang"],
			"additionalProperties": false,
			"properties": {
				"url": { "$ref": "#/$defs/hostedUrl" },
				"title": { "type": "string" },
				"type": { "type": "string" },
				"lang": { "type": "string", "pattern": "^[a-z]{2}$" }
			}
		},
		"hostedUrl": {
			"description": "Every document is a file we host (owner ruling 2026-09-02).",
			"type": "string",
			"pattern": "^https://de-linker\\.com/"
		}
	}
}
